{
  "$schema": "../data/menu.schema.json",
  "cafe": {
    "name": "Зерно",
    "address": "ул. Панфилова, 98",
    "city": "Алматы",
    "hours": "до 22:00"
  },
  "currency": "KZT",
  "specials": [
    {
      "label": "Блюдо дня",
      "item": "lagman"
    },
    {
      "label": "Напиток дня",
      "item": "seabuckthorn"
    },
    {
      "label": "Комбо дня",
      "item": "combo_morning"
    }
  ],
  "items": [
    {
      "id": "espresso",
      "name": "Эспрессо",
      "category": "coffee",
      "sizes": [
        {
          "label": "Сингл",
          "size_ml": 30,
          "price": 700
        },
        {
          "label": "Доппио",
          "size_ml": 60,
          "price": 900
        }
      ],
      "short": "Плотный шот из нашей арабики",
      "description": "Классический эспрессо на смеси бразильской и эфиопской арабики средней обжарки. Ноты молочного шоколада, лесного ореха и лёгкая ягодная кислинка.",
      "emoji": "☕",
      "nutrition": {
        "kcal": 2,
        "protein": 0.1,
        "fat": 0,
        "carbs": 0.3
      },
      "ingredients": [
        "Кофе 100% арабика",
        "Фильтрованная вода"
      ],
      "prep_min": 3
    },
    {
      "id": "americano",
      "name": "Американо",
      "category": "coffee",
      "sizes": [
        {
          "label": "S",
          "size_ml": 250,
          "price": 900
        },
        {
          "label": "M",
          "size_ml": 350,
          "price": 1100
        },
        {
          "label": "L",
          "size_ml": 450,
          "price": 1300
        }
      ],
      "short": "Эспрессо, раскрытый горячей водой",
      "description": "Двойной эспрессо, разбавленный горячей водой. Мягкий и чистый вкус — хорошо пьётся как сам по себе, так и с молоком.",
      "emoji": "☕",
      "nutrition": {
        "kcal": 5,
        "protein": 0.3,
        "fat": 0,
        "carbs": 0.8
      },
      "ingredients": [
        "Двойной эспрессо",
        "Горячая вода"
      ],
      "prep_min": 3
    },
    {
      "id": "cappuccino",
      "name": "Капучино",
      "category": "coffee",
      "sizes": [
        {
          "label": "S",
          "size_ml": 250,
          "price": 1100
        },
        {
          "label": "M",
          "size_ml": 350,
          "price": 1300
        },
        {
          "label": "L",
          "size_ml": 450,
          "price": 1500
        }
      ],
      "short": "Эспрессо и нежная молочная пена",
      "description": "Баланс эспрессо и бархатистого молока с плотной микропеной. Самый популярный напиток нашей кофейни — бариста украсит его латте-артом.",
      "emoji": "☕",
      "badge": "Хит",
      "nutrition": {
        "kcal": 95,
        "protein": 5,
        "fat": 5,
        "carbs": 7
      },
      "ingredients": [
        "Эспрессо",
        "Молоко 3,2%",
        "Молочная микропена"
      ],
      "prep_min": 4
    },
    {
      "id": "latte",
      "name": "Латте",
      "category": "coffee",
      "sizes": [
        {
          "label": "S",
          "size_ml": 250,
          "price": 1200
        },
        {
          "label": "M",
          "size_ml": 350,
          "price": 1400
        },
        {
          "label": "L",
          "size_ml": 450,
          "price": 1600
        }
      ],
      "short": "Больше молока, мягкий вкус",
      "description": "Эспрессо с большим количеством взбитого молока и тонким слоем пены. Можно добавить сироп: ваниль, карамель, лесной орех.",
      "emoji": "🥛",
      "nutrition": {
        "kcal": 120,
        "protein": 6,
        "fat": 6,
        "carbs": 10
      },
      "ingredients": [
        "Эспрессо",
        "Молоко 3,2%"
      ],
      "prep_min": 4
    },
    {
      "id": "raf",
      "name": "Раф ванильный",
      "category": "coffee",
      "sizes": [
        {
          "label": "S",
          "size_ml": 250,
          "price": 1400
        },
        {
          "label": "M",
          "size_ml": 350,
          "price": 1600
        },
        {
          "label": "L",
          "size_ml": 450,
          "price": 1800
        }
      ],
      "short": "Сливочный кофе с ванилью",
      "description": "Эспрессо, взбитый вместе со сливками и ванильным сахаром. Нежная, почти десертная текстура и тёплый ванильный аромат.",
      "emoji": "🍦",
      "nutrition": {
        "kcal": 230,
        "protein": 4,
        "fat": 16,
        "carbs": 18
      },
      "ingredients": [
        "Эспрессо",
        "Сливки 10%",
        "Ванильный сахар"
      ],
      "prep_min": 5
    },
    {
      "id": "flatwhite",
      "name": "Флэт уайт",
      "category": "coffee",
      "sizes": [
        {
          "label": "S",
          "size_ml": 200,
          "price": 1300
        },
        {
          "label": "M",
          "size_ml": 300,
          "price": 1500
        }
      ],
      "short": "Двойной эспрессо и шёлковое молоко",
      "description": "Больше кофе, меньше молока. Двойной ристретто и тонкий слой глянцевого молока — для тех, кто любит выраженный кофейный вкус.",
      "emoji": "☕",
      "nutrition": {
        "kcal": 90,
        "protein": 5,
        "fat": 5,
        "carbs": 6
      },
      "ingredients": [
        "Двойной ристретто",
        "Молоко 3,2%"
      ],
      "prep_min": 4
    },
    {
      "id": "mocha",
      "name": "Моккачино",
      "category": "coffee",
      "sizes": [
        {
          "label": "S",
          "size_ml": 250,
          "price": 1400
        },
        {
          "label": "M",
          "size_ml": 350,
          "price": 1600
        },
        {
          "label": "L",
          "size_ml": 450,
          "price": 1800
        }
      ],
      "short": "Кофе, шоколад и взбитые сливки",
      "description": "Эспрессо с бельгийским шоколадом и горячим молоком, сверху — шапка взбитых сливок и какао. Согревает лучше любого пледа.",
      "emoji": "🍫",
      "nutrition": {
        "kcal": 210,
        "protein": 6,
        "fat": 11,
        "carbs": 22
      },
      "ingredients": [
        "Эспрессо",
        "Молоко 3,2%",
        "Бельгийский шоколад",
        "Взбитые сливки",
        "Какао"
      ],
      "prep_min": 5
    },
    {
      "id": "thyme",
      "name": "Чёрный чай с чабрецом",
      "category": "tea",
      "sizes": [
        {
          "label": "Малый",
          "size_ml": 500,
          "price": 1200
        },
        {
          "label": "Большой",
          "size_ml": 1000,
          "price": 1900
        }
      ],
      "short": "Цейлонский чай и горные травы",
      "description": "Крупнолистовой цейлонский чай с чабрецом. Подаём в чайнике с лимоном и сахаром по желанию.",
      "emoji": "🫖",
      "nutrition": {
        "kcal": 2,
        "protein": 0,
        "fat": 0,
        "carbs": 0.4
      },
      "ingredients": [
        "Чёрный чай (Цейлон)",
        "Чабрец",
        "Лимон"
      ],
      "prep_min": 4
    },
    {
      "id": "sencha",
      "name": "Зелёная сенча",
      "category": "tea",
      "sizes": [
        {
          "label": "Малый",
          "size_ml": 500,
          "price": 1300
        },
        {
          "label": "Большой",
          "size_ml": 1000,
          "price": 2000
        }
      ],
      "short": "Японский зелёный чай",
      "description": "Свежий травянистый вкус с ноткой морского бриза. Завариваем при 80 °C, чтобы чай не горчил.",
      "emoji": "🍵",
      "nutrition": {
        "kcal": 2,
        "protein": 0,
        "fat": 0,
        "carbs": 0.3
      },
      "ingredients": [
        "Зелёный чай сенча"
      ],
      "prep_min": 4
    },
    {
      "id": "seabuckthorn",
      "name": "Облепиховый чай",
      "category": "tea",
      "sizes": [
        {
          "label": "Малый",
          "size_ml": 500,
          "price": 1600
        },
        {
          "label": "Большой",
          "size_ml": 1000,
          "price": 2600
        }
      ],
      "short": "Облепиха, апельсин, мёд и имбирь",
      "description": "Яркий согревающий чай из протёртой облепихи с апельсином, мёдом, имбирём и палочкой корицы. Витаминный заряд на весь день.",
      "emoji": "🍊",
      "badge": "Хит",
      "nutrition": {
        "kcal": 90,
        "protein": 0.6,
        "fat": 1.2,
        "carbs": 22
      },
      "ingredients": [
        "Облепиха",
        "Апельсин",
        "Мёд",
        "Имбирь",
        "Корица",
        "Чёрный чай"
      ],
      "prep_min": 6
    },
    {
      "id": "matcha",
      "name": "Матча латте",
      "category": "tea",
      "sizes": [
        {
          "label": "S",
          "size_ml": 250,
          "price": 1500
        },
        {
          "label": "M",
          "size_ml": 350,
          "price": 1700
        },
        {
          "label": "L",
          "size_ml": 450,
          "price": 1900
        }
      ],
      "short": "Японский чай матча с молоком",
      "description": "Церемониальная матча, взбитая венчиком и смешанная с молоком. Можно заменить молоко на овсяное или кокосовое.",
      "emoji": "🍵",
      "nutrition": {
        "kcal": 140,
        "protein": 7,
        "fat": 6,
        "carbs": 14
      },
      "ingredients": [
        "Матча",
        "Молоко 3,2%",
        "Тростниковый сахар"
      ],
      "prep_min": 5
    },
    {
      "id": "icelatte",
      "name": "Айс латте",
      "category": "cold",
      "sizes": [
        {
          "label": "M",
          "size_ml": 350,
          "price": 1400
        },
        {
          "label": "L",
          "size_ml": 450,
          "price": 1600
        }
      ],
      "short": "Эспрессо, холодное молоко и лёд",
      "description": "Освежающий латте со льдом. Хорош с карамельным или кокосовым сиропом.",
      "emoji": "🧋",
      "nutrition": {
        "kcal": 110,
        "protein": 5,
        "fat": 5,
        "carbs": 9
      },
      "ingredients": [
        "Эспрессо",
        "Молоко 3,2%",
        "Лёд"
      ],
      "prep_min": 4
    },
    {